{
  "schema_version": "0.1.0",
  "screen": {
    "id": "paired-uikit-detail-after-home-action",
    "captured_at": "2026-08-08T23:31:01.146Z",
    "image_size_pixels": { "width": 1206, "height": 2622 },
    "viewport_size_points": { "width": 402, "height": 874 },
    "orientation": "portrait",
    "sources": ["screenshot", "ui_tree"]
  },
  "elements": [],
  "relations": [],
  "changes": []
}
