{
  "schema_version": "0.1.0",
  "screen": {
    "id": "paired-swiftui-form",
    "captured_at": "2026-08-08T22:12:15Z",
    "image_size_pixels": { "width": 1206, "height": 2622 },
    "viewport_size_points": { "width": 402, "height": 874 },
    "orientation": "portrait",
    "sources": ["screenshot"]
  },
  "elements": [],
  "relations": [],
  "changes": []
}
